{
  "id": "bodensee-weekend-2026",
  "title": "Bodensee — Where Three Countries Meet",
  "tagline": "Bronze Age villages under water, the world's last airships, and a castle older than Charlemagne",
  "destination": {
    "name": "Bodensee (Lake Constance)",
    "region": "Bavaria / Baden-Württemberg, Germany",
    "lat": 47.656,
    "lon": 9.4788
  },
  "origin": {
    "name": "Munich",
    "lat": 48.1351,
    "lon": 11.582
  },
  "drive_time_from_origin_minutes": 110,
  "duration_days": 2,
  "generated_at": "2026-03-22",
  "updated_at": "2026-03-22",
  "stats": {
    "total_stops": 6,
    "baby_friendly_score": 4,
    "history_depth_score": 5,
    "touristic_score": 2,
    "drive_total_km": 190
  },
  "intro": "The Bodensee sits at the junction of Germany, Austria, and Switzerland, and its shores carry 4,000 years of history in an unusually dense stretch of land: Neolithic and Bronze Age villages preserved under the water, the cradle of the modern airship, a monastery island that once produced the finest illuminated manuscripts in Europe, and a city that ended the worst crisis in medieval Christianity and burned a reformer at the stake for good measure. Most visitors come for the views and the wine. You'll come for everything underneath.",
  "route_polyline": [
    [
      48.1351,
      11.582
    ],
    [
      48.0012,
      11.0234
    ],
    [
      47.8701,
      10.6245
    ],
    [
      47.7265,
      10.3145
    ],
    [
      47.5462,
      9.6817
    ]
  ],
  "days": [
    {
      "day_number": 1,
      "title": "Lindau → Friedrichshafen → Unteruhldingen → Meersburg",
      "theme": "Island town, airships, Bronze Age, oldest castle",
      "summary": "From Roman harbor to Bronze Age lake villages to a 7th-century castle",
      "stops": [
        {
          "id": "lindau",
          "sequence": 1,
          "name": "Lindau",
          "subtitle": "The island city on the lake",
          "lat": 47.5462,
          "lon": 9.6817,
          "category": "town_center",
          "visit_duration_minutes": 90,
          "drive_time_from_prev_minutes": 0,
          "baby_friendly_score": 5,
          "highlight": "A medieval free imperial city on an island in the lake, with a Roman harbor entrance guarded by a stone lion",
          "about": "Lindau is built on a small island connected to the mainland by a bridge and causeway, and it has been an important crossing point since the Romans established a garrison here in the 3rd century AD. The harbor entrance — flanked by a 33-meter lighthouse and a stone Bavarian lion — is one of the most photographed views on the Bodensee, though what most visitors miss is what the lion represents: Lindau was a Free Imperial City from 1275, answerable directly to the Holy Roman Emperor and no one else, a status it held for almost 600 years. The old town is extraordinarily intact: the Peterskirche dates to the 10th century, the Diebsturm (Thieves' Tower) to the 13th, and the stepped-gable Rathaus to 1422. In 1530, the Lindau delegation to the Diet of Augsburg signed the Augsburg Confession alongside the Protestant princes — one of the founding documents of the Reformation.",
          "hidden_gems": "Almost everyone stays on the main promenade. Walk instead to the northern tip of the island to the Heidenmauer — a stretch of Roman wall that most visitors walk past without realizing it predates the medieval town by a thousand years. For coffee, skip the harbor cafés and go to Café Hoyerberg on the mainland hill above Lindau: the view over the island and the Austrian Alps across the water is better than anything on the island itself, and it is almost entirely local. On a clear day you can see the Pfänder mountain above Bregenz and, beyond it, the Swiss Alps.",
          "baby_logistics": "Lindau is one of the most stroller-friendly stops on this entire trip — the island is flat, the main streets are paved, and there are benches everywhere. The harbor promenade has a ramp down to the waterfront. Changing facilities in the public toilets near the harbor. Parking is on the mainland; use the Parkhaus Inselbahnhof and walk across.",
          "tier": 1,
          "skip_if_rushed": false
        },
        {
          "id": "zeppelin-museum",
          "sequence": 2,
          "name": "Zeppelin Museum Friedrichshafen",
          "subtitle": "The world's greatest airship museum",
          "lat": 47.6554,
          "lon": 9.4802,
          "category": "museum",
          "visit_duration_minutes": 120,
          "drive_time_from_prev_minutes": 40,
          "baby_friendly_score": 5,
          "highlight": "A full-scale recreation of the passenger gondola of the Hindenburg, with original furniture still intact, in the hangar where it was built",
          "about": "Ferdinand von Zeppelin was born near Konstanz in 1838 and spent thirty years as a cavalry general before retiring at 52 and devoting the rest of his life to building rigid airships. The LZ 1 made its first flight over the Bodensee in 1900, barely achieving 6km/h against the wind. By the 1930s, the LZ 127 Graf Zeppelin had made 590 flights including 144 transatlantic crossings, carried over 13,000 passengers, and circumnavigated the globe. The LZ 129 Hindenburg — 245 meters long, the largest flying object ever built — made 36 crossings of the Atlantic before bursting into flames at Lakehurst, New Jersey in 1937 in front of a live radio broadcast. The disaster ended the airship era within a year. The museum holds the most important collection of Zeppelin artifacts in the world, including a full-scale recreation of the Hindenburg's passenger section: the dining room, the lounge, the observation windows overlooking the ocean. The engineering of these objects is almost incomprehensible — a rigid aluminum skeleton 245 meters long, covered in cotton fabric, filled with hydrogen, carrying 50 passengers in pressurized luxury across the Atlantic in 60 hours.",
          "hidden_gems": "Most visitors spend all their time in the Zeppelin hall and skip the fine art collection upstairs — a serious mistake. The museum's upper floor has one of the strongest collections of Expressionist and Neue Sachlichkeit art in southern Germany, including major works by Otto Dix and Max Beckmann. The Dornier Museum is a 10-minute walk away and covers the flying boat and military aircraft manufacturer that was also based in Friedrichshafen — together the two museums make Friedrichshafen one of the most important aviation history sites in Europe. Most people know neither exists.",
          "baby_logistics": "Fully accessible throughout — elevator between floors, flat exhibition spaces, wide corridors for strollers. There is a good café on the ground floor with high chairs. The lakefront promenade directly outside is flat and perfect for a post-museum walk. Baby changing room in the main toilets block.",
          "tier": 1,
          "skip_if_rushed": false
        },
        {
          "id": "pfahlbaumuseum",
          "sequence": 3,
          "name": "Pfahlbaumuseum Unteruhldingen",
          "subtitle": "Bronze Age villages, rebuilt over the water",
          "lat": 47.7674,
          "lon": 9.2637,
          "category": "museum",
          "visit_duration_minutes": 90,
          "drive_time_from_prev_minutes": 25,
          "baby_friendly_score": 4,
          "highlight": "Walk through reconstructed Neolithic and Bronze Age pile-dwelling houses built directly over the lake — the same spot where the originals stood 4,000 years ago",
          "about": "When Lake Constance water levels dropped dramatically in the 1850s, local fishermen began finding extraordinarily well-preserved wooden objects in the lake sediment near Unteruhldingen — tools, textiles, leather, food remains, entire structural timbers from houses — dating back 4,000 to 6,000 years. The anaerobic conditions under the lake had preserved organic material that would have rotted anywhere else on Earth within decades. What emerged was evidence of Neolithic and Bronze Age communities who built their villages on wooden platforms directly over the shallow water: the pile dwellings. The open-air museum at Unteruhldingen reconstructs these settlements with extraordinary accuracy — you walk through Bronze Age homes, see the hearths, the storage vessels, the tools. The lake sediment around the museum contains the actual original site, which was designated a UNESCO World Heritage Site in 2011 jointly with 110 other Alpine pile dwelling sites across Germany, Austria, Switzerland, France, Italy, and Slovenia. This is one of the most important prehistoric archaeological sites in Central Europe, and almost no one outside Germany has heard of it.",
          "hidden_gems": "The museum boat trip gives you a view of the reconstruction from the water and a proper sense of how these villages related to the lake. It runs on the hour and takes 20 minutes. The underwater archaeology exhibition inside the main building shows the actual objects retrieved from the sediment — the preserved leather shoes, wooden ladles, and fabrics are more affecting than the reconstructed houses because they are real and 4,000 years old. Pick up the small illustrated guide in the shop; the scholarship behind the reconstructions is serious and the guide explains the choices made.",
          "baby_logistics": "The walkway over the water between the pile dwelling reconstructions is wooden and has railings but is narrow in places — a stroller works but requires care on the turns. A carrier is more comfortable. The indoor exhibition hall is fully accessible. There is a lakeside terrace café with simple food and high chairs. One small changing room near the entrance.",
          "tier": 2,
          "skip_if_rushed": false
        },
        {
          "id": "meersburg",
          "sequence": 4,
          "name": "Meersburg Altes Schloss",
          "subtitle": "The oldest inhabited castle in Germany",
          "lat": 47.6941,